"Multi-Tech Consult (PTY) Ltd.","Plot 20746, Block 3 Industrial Gaborone Botswana","Botswana","2023-12-05T01:00:59Z","2027-06-04T12:00:59Z","2024-02-12T12:00:59Z","World Bank Group","Fraudulent Practice"
"Multistar Holdings Limited (Formerly Multi-Con Systems PTE Ltd.)","Hock Seng Building, #03-02, 114 Lavender Street, Singapore 338729","Singapore",,Ongoing,"2016-03-23T02:17:59Z","World Bank Group","Corrupt Practice"
"Mustafa Haji Alwy","#14 Hercules Street D. 14. Curug Permai Residence Bogor City 16113 West Java Province INDONESIA","Indonesia",,Indefinite,"2021-06-25T08:18:59Z","Asian Development Bank","Fraudulent Practice"
"N.C. Sanitors & Service Corporation ","Opposite Liberia Broadcasting System Paynesville Monrovia Liberia","Liberia","2014-12-16T02:56:59Z","2027-12-15T02:57:59Z","2016-11-18T02:57:59Z","World Bank Group","Corrupt Practice"
"NJS Co., Ltd.  Formerly operating as NJS Consultants Co., Ltd.","1-1-1, Shibaura, Minato-ku Tokyo, 105-0023 Japan","Japan","2022-08-30T12:00:59Z","2025-09-29T12:00:59Z","2022-12-02T12:00:59Z","World Bank Group","Corrupt and Fraudulent Practices"
"NOBSACONSTRUCCIONES S.A.","Urdesa, calle 2 casa No. 714 A entre Ficus y Guayacanes, Guayaquil, Ecuador","Ecuador","2018-10-31T12:00:59Z","2030-10-30T12:00:59Z","2018-12-13T12:00:59Z","Inter-American Development Bank Group","Corrupt Practice"
"NOVA INVESTMENT S.A.","25c Boulevard Royal L-2449 Luxembourg","Turkiye","2024-06-07T12:00:59Z","2025-05-06T12:00:59Z","2024-06-07T12:00:59Z","European Bank for Reconstruction and Development","Fraudulent Practices"
"NREM International Inc.","Suite 1150, World Exchange Plaza, 25 O'Connor Street, Ottawa, Ontario, Canada KIP 1A4 5914 Gartrell Road, Summerland, BC Canada V0H 1 Z7","Canada",,Ongoing,"2022-03-11T08:21:59Z","World Bank Group","Fraudulent Practice"
"NREM International Inc.","Suite 1402, Yufei Plaza, 42 Dongzhimenwai Dajie, Beijing 100027, People's Republic of China","China",,Ongoing,"2022-03-11T08:23:59Z","World Bank Group","Fraudulent Practice"
"Nanchang Hehong Construction Co., Ltd.","Room 1505, 15th Floor, Block A, Shi'ao Building No. 555 Diezihu Avenue Honggutan District Nanchang City Jiangxi Province China","China",,Ongoing,"2022-12-02T12:54:59Z","World Bank Group","Fraudulent Practice"
"Nanjing China Nuclear Huaxing Nuclear Power Equipment Manufacture Ltd","Tiancheng Road, Binjiang Economic Development Zone, Jiangning District, Nanjing City, Jiangsu Province, China","China",,Ongoing,"2020-09-14T10:59:59Z","World Bank Group","Fraudulent Practice"
"Nanning Xingdian Concrete Co., Ltd.","No.93, Santang South Road Xingning District Nanning People's Republic of China","People's Republic of China","2024-07-01T12:00:59Z","2025-05-31T12:00:59Z","2024-07-01T12:00:59Z","EBRD","Fraudulent Practice"
"National Alimentation Services","39 Tabarre, 48 Blvd 15 Octobre Port-Au-Prince Haiti Tabarre 60 #25, En Face de la Sunauto, Port-Au-Prince, Haiti","Haiti",,Ongoing,"2018-03-30T12:00:59Z","World Bank Group","Fraudulent Practice"
"National Bio-Medical Pvt. Ltd.","Tripurapath, Tripureswor Kathmandu Nepal","Nepal",,Ongoing,"2024-05-15T12:00:59Z","World Bank Group","Fraudulent Practice"
"Nelson Alexander Nunez Gonzalez","Kilometro 14 Carretera Panamericana frente a la Colonia Tierra Virgen San Martin El Salvador","El Salvador","2022-10-28T12:00:59Z","2037-10-27T12:00:59Z","2023-02-10T12:00:59Z","Inter-American Development Bank Group","Fraudulent and collusive practices"
"Newstech Vietnam Trading and Investment Construction Joint Stock Company","No. 14 – Adjacent Houses 6 Dai Thanh Urban Ta Thanh Oai Communal Thanh Tri District Hanoi Vietnam","Vietnam",,Ongoing,"2024-03-11T04:55:59Z","World Bank Group","Fraudulent Practice"
"NiemTin Company Limited","8th floor, 142 Doi Can Street Ba Dinh District Hanoi City Vietnam","Vietnam","2022-05-24T12:00:59Z","2025-03-23T12:00:59Z","2022-12-02T12:00:59Z","World Bank Group","Fraudulent Practice"
"Nishan Engineers (PVT) Limited","Nishan House 76-K Izmir Housing Society Multan Road Lahore, 54500 Pakistan","United Kingdom","2024-10-30T07:32:59Z","2028-02-28T07:32:59Z","2024-12-06T07:32:59Z","World Bank Group","Fraudulent Practice"
"Nishan Engineers UK Ltd.","103 Cypress Road Motherwell Scotland UK, ML1 5FS","United Kingdom","2024-10-30T07:34:59Z","2028-02-28T07:34:59Z","2024-12-06T07:34:59Z","World Bank Group","Fraudulent Practice"
"Nishan Trading UK Ltd.","41 Morrison Street Glasgow Scotland UK, G5 8LB","United Kingdom","2024-10-30T07:35:59Z","2028-02-28T07:35:59Z","2024-12-06T07:35:59Z","World Bank Group","Fraudulent Practice"
"Noah Rosenkrantz","C/O Brigida Benitez Steptoe & Johnson LLP 1330 Connecticut Ave., NW Washington, DC 20036 USA","United States of America","2021-09-20T10:40:59Z","2029-09-19T10:41:59Z","2021-12-03T11:42:59Z","Inter-American Development Bank Group","Corrupt Practice"
"Nortex Link LLP","60A Zhandosov Street Office 406 Bostandyk District, Almaty, 050060 Kazakhstan","Kazakhstan",,Ongoing,"2022-03-11T01:49:59Z","World Bank Group","Collusive Practice"
"Novo Horizonte Const. E Cons. E Comercio Ltda","Av. General Rivas, No. 235 letra B Liberdade, Santa Rita, Maranhão, Brazil","Brazil",,Ongoing,"2017-05-31T11:29:59Z","World Bank Group","Corrupt Practice"
"NovoLine Resources L.P.","Office 1, 145 Kilmarnock Road Glasgow G41 3JA Scotland United Kingdom","United Kingdom",,Ongoing,"2024-05-31T10:36:59Z","World Bank Group","Fraudulent Practice"
"OAO Dustlik","20 Oktyabarsky Str., Syzak Village, Suzak District, Jalal-Abad Region, Kyrgyz Republic","Kyrgyz Republic",,Ongoing,"2017-05-31T03:58:59Z","World Bank Group","Fraudulent Practice"
"OAS Energy GmbH","Albert-gasse n. 35, 1080 Vienna Austria","Austria","2022-03-18T12:00:59Z","2025-03-17T12:00:59Z","2022-05-26T12:00:59Z","Inter-American Development Bank Group","Collusive and corrupt practices"
"OAS Energy GmbH - Sucursal Portugal","Rua Avenida Brasil n. 15, 1° andar 1749-112, Lisboa Portugal","Portugal","2022-03-18T12:00:59Z","2025-03-17T12:00:59Z","2022-05-26T12:00:59Z","Inter-American Development Bank Group","Collusive Practice"
"OAS International Engineering GmbH","Donaustadtstraße 1 /5, 1220 Vienna Austria","Austria","2022-03-18T12:00:59Z","2025-03-17T12:00:59Z","2022-05-26T12:00:59Z","Inter-American Development Bank Group","Collusive Practice"
"OAS Nacala Limitada","Rua Arnaldo Segundo S/N. Bloco 1 Nacala-Porto Mozambique","Mozambique","2022-03-18T12:00:59Z","2025-03-17T12:00:59Z","2022-05-26T12:00:59Z","Inter-American Development Bank Group","Collusive and corrupt practices"
"OGON ASU LIMITED","47 Haile Selassie Street Asokoro Abuja FCT Nigeria","Nigeria",,Ongoing,"2024-08-05T01:17:59Z","African Development Bank","Fraudulent Practice"
"ON-TRACK TECHNICAL SERVICES LIMITED","Plot 1, Kibuga Block Mengo P.O Box 75101 Kampala Uganda","Uganda",,Ongoing,"2022-04-22T02:02:59Z","African Development Bank","Fraudulent Practice"
"OOO Fides Solutions","Room 25a, No. 50, Oybek Street, Tashkent, Uzbekistan","Uzbekistan",,Ongoing,"2022-12-02T01:00:59Z","World Bank Group","Corrupt Practice"
"OOO RBC Center ","15, 5th Donskoy Proezd, Building 6, 117344, Moscow, Russian Federation","Russian Federation","2014-05-02T12:09:59Z",Ongoing,"2014-08-13T12:10:59Z","World Bank Group","Fraudulent Practice"
"OZALTIN 2 ENERJI YATIRIMLARI A.S.","Nene Hatun Cad. No:115 Cankaya, Ankara, Turkiye","Türkiye","2024-06-07T12:00:59Z","2025-05-06T12:00:59Z","2024-06-07T12:00:59Z","European Bank for Reconstruction and Development","Fraudulent Practice"
"OZALTIN 3 ENERJI YATIRIMLARI A.S.","Nene Hatun Cad. No:115 Cankaya, Ankara, Turkiye","Türkiye","2024-06-07T12:00:59Z","2025-05-06T12:00:59Z","2024-06-07T12:00:59Z","European Bank for Reconstruction and Development","Fraudulent Practice"
"OZALTIN HOLDING A.S.","Nene Hatun Cad. No:115 Cankaya, Ankara, Turkiye","Turkiye","2024-06-07T12:00:59Z","2025-05-06T12:00:59Z","2024-06-07T12:00:59Z","European Bank for Reconstruction and Development","Fraudulent Practices"
"OZALTIN ITHALAT
IHRACAT VE INSAAT A.S.","Nene Hatun Cad. No:115 Cankaya, Ankara, Turkiye","Turkiye","2024-06-07T12:00:59Z","2025-05-06T12:00:59Z","2024-06-07T12:00:59Z","European Bank for Reconstruction and Development","Fraudulent Practices"
"OZALTIN OTEL ISLETMELERI A.S.","Nene Hatun Cad. No:115 Cankaya, Ankara, Turkiye","Türkiye","2024-06-07T12:00:59Z","2025-05-06T12:00:59Z","2024-06-07T12:00:59Z","European Bank for Reconstruction and Development","Fraudulent Practice"
"OZALTIN SERACILIK VE
TICARET A.S.","Nene Hatun Cad. No:115 Cankaya, Ankara, Turkiye","Turkiye","2024-06-07T12:00:59Z","2025-05-06T12:00:59Z","2024-06-07T12:00:59Z","European Bank for Reconstruction and Development","Fraudulent Practices"
"Oceanic Construction and Engineering Nigeria Limited","1133 Aminu Kano Cresent Wuse 11 Abuja. Nigeria","Nigeria",,Ongoing,"2023-04-24T09:36:59Z","African Development Bank","Fraudulent Practice"
"Odebrecht Latinvest Concesionarias S.A.C.","Avenida Victor Andrés Belaunde Nº 280, interior 502, distrito de San isidro, Lima, Perú","Peru","2019-01-29T12:18:59Z","2024-08-01T11:18:59Z","2019-11-01T12:18:59Z","Inter-American Development Bank Group","Corrupt Practice"
"Odelga Med Ges.M.B.H.","Carlbergergasse 68 1230 Vienna Austria","Austria","2021-06-08T12:00:59Z","2027-06-07T12:00:59Z","2022-01-14T12:00:59Z","World Bank Group","Corrupt Practice"
"Olive Health Care","Godrej Coliseum Somaiya Hospital Road · B-3, 2nd Floor Sion (East) Mumbai 400 022 India","India","2017-07-21T01:45:59Z","2028-01-20T02:45:59Z","2018-01-05T02:45:59Z","World Bank Group","Fraudulent Practice"
"Omar Enrique Álvarez Escorcia","Calle 98 No. 42 G 61 Torre 3 Apartamento 403 Mirador del Mar l. Barranquilla Colombia","Colombia","2021-11-08T02:21:59Z","2030-11-07T02:21:59Z","2022-03-11T02:21:59Z","Inter-American Development Bank Group","Fraudulent Practice"
"Orange Capital Limited","7th Flor, Ruttonjee House 11 Duddell Street Central Hong Kong Hong Kong","Afghanistan","2021-10-27T12:00:59Z","2031-10-26T05:58:59Z","2022-03-11T12:00:59Z","Inter-American Development Bank Group","Corrupt Practice"
"Oregon Pacific International Co. Ltd.","Small Industries Centre 102 Ma/ufanga Nuku'alofa Tonga","Tonga",,Ongoing,"2020-09-14T11:14:59Z","World Bank Group","Fraudulent Practice"
"Ostek Construction Electric Automation System Technologies Ltd","Mesrutiyet Cad. Hatay Sk. No: 20/7, Kizilay, Ankara, Turkey","Turkey",,Ongoing,"2017-05-31T03:51:59Z","World Bank Group","Fraudulent Practice"
"Ozaltın Insaat Ticaret Ve Sanayi Anonim Sirketi ","Kazim Ozalp Mahallesi, Nene Hatun Caddesi No. 115 06680, Cankaya, Ankara Turkiye","Türkiye","2024-06-07T09:43:59Z","2025-05-06T09:43:59Z","2024-06-07T09:43:59Z","European Bank for Reconstruction and Development","Fraudulent Practice"
"P-Square Associates, Co.","Unit 4a, 4th Floor J &P Building, Lot 3, Blk 17.V.V. Soliven Ave 1, San Isidro, Cainta Rizal Philippines","Philippines",,Ongoing,"2020-05-18T08:30:59Z","World Bank Group","Collusive Practice"
"PICSA Proyectos de Ingenieria Civil y Sanitaria ","Diagonal 12, 10-61; Zona 1, Quetzaltenango","Guatemala","2015-01-01T05:42:59Z",Indefinite,"2016-02-25T05:42:59Z","Inter-American Development Bank Group","Collusive Practice"
"PODUVAL, Mohan Krishnan","250 Taman Pulasan Fasa 6 Jalan Alor Mengkudu Alor Setar Kedah Malaysia","Malaysia",,Indefinite,"2022-05-26T07:25:59Z","Asian Development Bank","Fraudulent Practice"
"PONTID MADENCILIKSAN. VE TIC. A.S.","Hilal Mah. Cezayir Cad.No: 15 Cankaya, Ankara , Turkiye","Türkiye","2024-06-07T12:00:59Z","2025-05-06T12:00:59Z","2024-06-07T12:00:59Z","European Bank for Reconstruction and Development","Fraudulent Practice"
"PSI Proyectos y Servicios de Infraestructura ","5a Calle 2a Avenida 4-36; Zona 10, Quetzaltenango","Guatemala",,Permanent,"2016-02-25T04:05:59Z","Inter-American Development Bank Group","Collusive Practice"
"PSL Engineering Private Limited","B-10/1, Okhla Industrial Estate, Phase-II, New Delhi 110020, India","India",,Ongoing,"2020-09-14T10:48:59Z","World Bank Group","Fraudulent Practice"
"PSL Engineering Pvt. Ltd.","159, Okhla Industrial Estate, Phase-III, New Delhi 110020","India",,Ongoing,"2020-07-06T08:25:59Z","World Bank Group","Fraudulent Practice"
"PT Citra Gading Asritama ","Jl. Gayung Kebonsari A-7, Surabaya, Indonesia","Indonesia","2012-08-07T01:14:59Z",Ongoing,"2014-12-01T02:14:59Z","World Bank Group","Fraudulent Practice"
"PT Ewaco Bumi Mamiri","Mailing address: Jl. Raya Kedungmundu RT 002 RW 001 Kel.Sambiroto Kec. Tembalang Semarang Provinsi Jawa Tengah Indonesia Physical address: Jln. Raya Kedungmundu C28 Semarang Provinsi Jawa Tengah Indonesia","Indonesia









Indonesia","2024-07-09T12:00:59Z","2029-12-08T12:00:59Z","2024-08-05T12:00:59Z","World Bank Group","Fraudulent, Corrupt, and Obstructive Practices"
"PT Rifa Bestari","Wisma STACO, 61 6th Floor Jalan Casabianca Kav 18 Jakarta 12870 Indonesia","Indonesia",,Indefinite,"2018-01-05T10:58:59Z","Asian Development Bank","Fraudulent Practice"
"PT Strategic Asia","C/O Dr. Satish Mishra Bali Jalan Badak Agung 19 No. 5 Renon Denpasar 80235 INDONESIA","Indonesia",,Ongoing,"2023-09-22T04:35:59Z","Asian Development Bank","Fraudulent Practice"
"PT. Areabangun Putra Sejati","Cipaganti Dream Land A-1 Jl. Jendral A.H. Nasution (Raya Ujungberung) Bandung 40612 West Java Indonesia","Indonesia",,Ongoing,"2022-03-11T01:53:59Z","World Bank Group","Fraudulent Practice"
"PT. Aris Makmur Mandiri","Jl. Raya Cigintung No. 126 A Bojong Kec. Cilimus Kuningan Indonesia 45556","Indonesia",,Ongoing,"2024-02-12T02:47:59Z","World Bank Group","Fraudulent Practice"
"PT. Bina Cipta Utama","Jl. Ksatria Gg. Anggrek No. 114 Kecamatan Kesambi Kota Cirebon Cirebon Indonesia 45134 Jl. Cideng Raya No. 48 Blok Srikembeng RT/RW 003/001 Ds. Kertawinangun Kec. Kedawung Cirebon Jawa Barat Indonesia 45153","Indonesia",,Ongoing,"2022-12-02T03:11:59Z","World Bank Group","Fraudulent Practice"
"PT. CNEC Engineering Indonesia","Boutique Office Park, A 12 Benjamin Subo road. Road, Kemayoran,Central Jakarta, Indonesia","Indonesia",,Ongoing,"2020-09-14T11:09:59Z","World Bank Group","Fraudulent Practice"
"PT. DDC Consultants ","Jl. Masjid an'nur No. 51A, Kebayoran Lama, Jakarta Selatan, Indonesia","Indonesia","2011-04-25T09:34:59Z",Ongoing,"2011-07-08T09:35:59Z","World Bank Group","Fraudulent Practice"
"PT. Gunakarya Nusantara","JI. Suryalaya XVIII No. 13 - 15 Buah Batu, Bandung 40265 West Java Indonesia","Indonesia",,Ongoing,"2020-12-16T10:03:59Z","World Bank Group","Fraudulent Practice"
"PT. Jaya Etika Teknik","Jl. Ketintang Baru Selatan VII/6 Surabaya Indonesia 60235","Indonesia",,Ongoing,"2023-03-30T12:00:59Z","World Bank Group","Corrupt Practice"
"PT. Karya Kita Putra Pertiwi","Jl. Raya Guntur No. 18 Kedongdong Kidul Dukupantang Cirebon Indonesia 45161","Indonesia",,Ongoing,"2024-02-12T02:42:59Z","World Bank Group","Fraudulent Practice"
"PT. LPPSLH Konsultan","Jl. Ngesrep Barat III No. 30 G, Kel. Srondol Kulon, Kec. Banyumanik Kota Semarang Provinsi Jawa Tengah Indonesia","Indonesia","2024-07-09T12:00:59Z","2029-12-08T12:00:59Z","2024-08-05T12:00:59Z","World Bank Group","Fraudulent, Corrupt, and Obstructive Practices"
"PT. Nugraha Adi Taruna","Jl. Bangka Raya No. 27 E. Pela Mampang, Jakarta Selatan Jakarta, Indonesia 12720 Jl. Kalibata Indah Blok T No. 16 Pancoran, Jakarta Selatan Jakarta, Indonesia 12510","Indonesia",,Ongoing,"2024-08-16T12:21:59Z","World Bank Group","Fraudulent Practice"
"PT. Rudy Jaya","JI. Gajah Mada No. 404 Desa Janti Kec. Tarik Sidoarjo, Jawa Timur Indonesia","Indonesia",,Ongoing,"2022-12-02T02:08:59Z","World Bank Group","Fraudulent Practice"
"PT. Suburo Jayan lndah Corp.","JI. Manunggal Pratama No. 8, Kel. Cipinang Melayu, Kec. Makassar Jakarta Timur 13620 Republic of Indonesia","Indonesia",,Ongoing,"2023-08-04T03:57:59Z","World Bank Group","Fraudulent Practice"
"PT. Tirta Wijaya Karya","Jl. Otto Iskandardinata No. 297 Subang Jawa Barat Indonesia 41217","Indonesia",,Ongoing,"2023-08-25T01:00:59Z","World Bank Group","Fraudulent Practice"
"PT. Tubagus Rangin","'Jl. Siti Armilah No. 54 RT/RW 002/013 Majalengka Kulon Jawa Barat Indonesia 45418'","Indonesia",,Ongoing,"2023-02-10T12:02:59Z","World Bank Group","Fraudulent Practice"
"Pau Llopart Vidal","Calle 50 con calle Elvira Méndez Edificio Financial Center (Towerbank) Piso 29 Panama City Panama","Panama","2022-03-25T12:00:59Z","2032-03-24T12:00:59Z","2022-05-26T12:00:59Z","Inter-American Development Bank Group","Fraudulent Practice"
"Pedro Alejandro Egusquiza Melendez","'Av. Aurelio Miroquesada No. 576 Departamento 1001 Distrito de San Isidro Provincia y Departamento de Lima'","Peru","2023-06-30T09:20:59Z","2026-01-01T10:20:59Z","2023-09-22T09:20:59Z","Inter-American Development Bank Group","Fraudulent Practice"
"Perfect Dredging Company Pvt. Ltd.","Suite No. 205, II Floor, Plaza Centre 129 G.N. Chetty Road Chennai 600 006 Tamil Nadu India","India","2024-01-17T01:00:59Z","2031-01-16T01:00:59Z","2024-03-11T12:00:59Z","World Bank Group","Collusive Practice"
"Pewee Flomo","Topoe Avenue Gaye Town, Old Road Sinkor Monrovia Liberia","Liberia",,Ongoing,"2020-07-06T08:20:59Z","World Bank Group","Fraudulent Practice"
"Pioneer Construction Ltd","'Plot 2B 5th Street Close Industrial Area P.O. Box 211 Kampala Uganda'","Uganda",,Ongoing,"2022-12-02T08:05:59Z","Asian Development Bank","Fraudulent Practice"
"Private Enterprise (PE) Rabmer","26, PL. Rynok, Sambir, 81400, Lvivska Oblast, Ukraine","Ukraine",,Ongoing,"2019-08-23T01:33:59Z","World Bank Group","Fraudulent Practice"
"Pro-Immobles S.L.","Calle 50 con calle Elvira Méndez Edificio Financial Center (Towerbank) Piso 29 Panama City Panama","Panama","2022-03-25T12:00:59Z","2032-03-24T12:00:59Z","2022-05-26T12:00:59Z","Inter-American Development Bank Group","Fraudulent Practice"
"Profinco Ltda.","Calle 31 No. 21-127 Barrio Cañaveral Floridablanca Santander Colombia","Colombia","2021-11-08T02:13:59Z","2024-11-07T02:13:59Z","2022-03-11T02:11:59Z","Inter-American Development Bank Group","Fraudulent Practice"
"Progressive Constructions Limited","7th Floor, Raghava North Block, Raghava Ratna Towers, Chirag Ali Lane, Abids, Hyderabad, 500 001, Andhra Pradesh, India","India",,Ongoing,"2024-12-06T12:42:59Z","World Bank Group","Fraudulent Practice"
"Project Construction S.A.C.","Calle Ricardo Angulo 834 Urb. Corpac-San Isidro Lima Peru","Peru",,Ongoing,"2018-01-05T10:58:59Z","World Bank Group","Fraudulent Practice"
"Project Consult Institute PCI Co., Ltd.","' #27 KING’S COLLEGE CIRCLE TORONTO ONTARIO M5S1A1 CANADA 31BT, PHUM SANSAM KOSAL 1 BOENG TUMPUN MEAN CHEY PHNOM PENH 12351 CAMBODIA #17 KHOUNBOULOM BOAD CHANTHABOURY VIENTIANE CAPITAL LAO PDR 5TH FLOOR SENTINAL PLACE BUILDING 41B LY THAI TO ST. HANOI VIETNAM #12 (0), PHI THU LANE 7 MILE, MAYANGONE OWNSHIP YANGON MYANMAR'","Cambodia",,Indefinite,"2022-12-02T07:53:59Z","Asian Development Bank","Fraudulent Practice"
"Proveeduria Medica","Mexico 3100 (C1233 ABL), Buenos Aires, Argentina","Argentina","2011-06-16T12:06:59Z",Ongoing,"2014-08-13T12:07:59Z","World Bank Group","Fraudulent Practice"
"Proyecto de Ingeniería Centro Americana S. de R.L.","Ciudad de Comayagüela Residencial La Fuente Casa No. 4308 y/o Residencial Las Uvas Sexta Entrada Bloque 7 Casa 67 Tegucigalpa Honduras","Honduras","2021-12-13T02:25:59Z","2024-12-12T02:25:59Z","2022-03-11T02:25:59Z","Inter-American Development Bank Group","Collusive Practice"
"Proyectos Diversos Integrados S.A. de C.V.","Kilometro 14 Carretera Panamericana frente a la Colonia Tierra Virgen San Mart�n El Salvador","El Salvador","2022-10-28T12:00:59Z","2037-10-27T12:00:59Z","2023-02-10T12:00:59Z","Inter-American Development Bank Group","Fraudulent and collusive practices"
"Proyectos Diversos Integrados SA de CV ","Urbanizacion Nuevos Horizontes Final Calle 2 Casa Numero 10 San Martin Departarnento de San Salvador San Salvador El Salvador","El Salvador",,Ongoing,"2020-12-16T09:46:59Z","World Bank Group","Fraudulent Practice"
"Proyectos de Ingeniería y Servicios para el Medio Ambiente S.A.S.","Carrera 12 97-80 Oficina 605 Bogota Colombia","Colombia","2023-08-31T10:19:59Z","2031-08-31T10:19:59Z","2023-11-27T11:19:59Z","Inter-American Development Bank Group","Fraudulent Practice"
"Proyectos y Mecanizados Diversos S.A. de C.V.","Residencia Villa del Sol III Senda 64 Numero 77 Llopango El Salvador","El Salvador","2022-10-28T12:00:59Z","2027-10-27T12:00:59Z","2023-02-10T12:00:59Z","Inter-American Development Bank Group","Fraudulent and collusive practices"
"Puriholi Nigeria","No. 12 Uche Okonkwo St., off DLA Road, Asaba, Delta State, Nigeria","Nigeria","2020-04-21T02:49:59Z","2026-11-20T03:50:59Z","2020-07-06T02:42:59Z","World Bank Group","Fraudulent Practice"
"Pyramind E&C Co. Ltd. Formerly PMA Property Management Agent Co., Ltd.","'903, 31BT, Phum Sansam Kosal 1 Boeng Tumpun Mean Chey Phnom Penh 12351 CAMBODIA'","Cambodia",,Indefinite,"2022-12-02T07:54:59Z","Asian Development Bank","Fraudulent Practice"
"Qiannan China Nuclear Dongsheng Construction Development Ltd","19F Tower B of Yundu International Economic Development Zone, Qiannan buyi ethnic miao autonomous prefecture, Guizhou Province, China","China",,Ongoing,"2020-09-14T11:01:59Z","World Bank Group","Fraudulent Practice"
"Qinghai Duolong Pumped Storage Co., Ltd.","Gonghe County Hainan Tibetan Autonomous Prefecture Qinghai Province People's Republic of China","People's Republic of China","2024-07-01T12:00:59Z","2025-05-31T12:00:59Z","2024-07-01T12:00:59Z","EBRD","Fraudulent Practice"
"Qualitrends Global Solutions Nigeria Ltd","Suite M, Innovation Plaza, Wuye Abuja, FCT, Nigeria","Nigeria",,Ongoing,"2022-05-26T07:24:59Z","African Development Bank","Fraudulent Practice"
"Quanzhou Quangang Geliu Engineering Management Co., Ltd.","No.5 Jinchuan Village Guan Road Shanshan Street Quangang District Quanzhou City People's Republic of China","People's Republic of China","2024-07-01T12:00:59Z","2025-05-31T12:00:59Z","2024-07-01T12:00:59Z","EBRD","Fraudulent Practice"
"Quvasoy Mukammal Tamir LLC","Logon 11 Fergana District Fergana Region Uzbekistan","Uzbekistan","2017-06-13T11:10:59Z","2025-05-12T11:10:59Z","2018-01-05T10:58:59Z","World Bank Group","Collusive Practice"
"RISMA Ltd.","Kyzl-Kia Town 126 Pervomaiskaia Str. Batken Oblast, Inn Kyrgyz Republic","Kyrgyz Republic",,Ongoing,"2018-08-07T12:00:59Z","World Bank Group","Fraudulent Practice"
"RKD Construction Pvt. Ltd.","B-20, Chandaka Industrial Estate Patia, Bhubaneswar 751024 India","India",,Ongoing,"2019-10-22T12:53:59Z","World Bank Group","Fraudulent Practice"
"Rafael "Ace" Freznoza Lim","Blk. 23, Lot 9, Twinpeak Drive St. Ridgemount Executive Village Taytay Rizal Philippines","Philippines",,Indefinite,"2016-11-18T03:40:59Z","Asian Development Bank","Collusive Practice"
"Reef Building Systems Limited","Milimani Flats, Milimani Road, Off State House,P.O. Box 10439-00400 NBI Nairobi , Kenya","Kenya","2013-07-09T01:31:59Z",Ongoing,"2013-12-20T02:31:59Z","World Bank Group","Fraudulent Practice"
"Regal Information Technology Private Limited","159, Okhla Industrial Estate, Phase-III, New Delhi 110020","India",,Ongoing,"2020-07-06T08:25:59Z","World Bank Group","Fraudulent Practice"
"Regional Communications Limited","Noble House 6 Brazil Street Castries Saint Lucia West Indies","St. Lucia","2016-09-20T02:54:59Z","2027-09-19T02:54:59Z","2017-05-31T02:54:59Z","Inter-American Development Bank Group","Fraudulent Practice"
"Ren Chao","No. 6 Efang First Road Weiyang District Xi'an City People's Republic of China","China","2020-08-07T02:21:59Z","2025-08-07T02:22:59Z","2021-04-28T02:22:59Z","Asian Development Bank","Collusive Practice"
"Representaciones Comerciales y Distribuidora Total S.A.","3a Avenida A 3-15, Zona 1, Guatemala City, Guatemala","Guatemala","2020-07-28T12:00:59Z","2033-07-27T12:00:59Z","2020-12-16T12:00:59Z","Inter-American Development Bank Group","Collusive Practice"
"Rishikesh Waste Management Ltd.  (Formerly known as A2Z Powertech Ltd.)","O-116, 1st Floor, DLF Shopping Mall Arjun Marg DLF PH-I Gurugram - 122002 Haryana India","India",,Ongoing,"2024-12-06T09:33:59Z","World Bank Group","Fraudulent Practice"
"Roberto Siqueira Nunes","c/o Kairos Construtora Ltda., Avenida Fernao Dias Paes Leme, 135 D - Altos, Conjunto Dom Pedro II, CEP: 69042-690, Manaus, AM, Brazil","Brazil",,Ongoing,"2023-08-25T01:00:59Z","World Bank Group","Fraudulent Practice"
"Rockey Africa Limited","P.O. Box 2680-00100 Nairobi Kenya","Kenya",,Ongoing,"2023-04-24T12:00:59Z","African Development Bank","Fraudulent Practice"
"Rojoke CNE Services Ltd.","No. 2, Pinto Avenue, Gana Sapele Delta State Nigeria","Nigeria",,Ongoing,"2024-03-11T12:22:59Z","World Bank Group","Fraudulent Practice"
"Ronel Jean Baptiste","Delmas 105, rue Audant #2, Entree Hopital Communautaire, Port-au-Prince, Haiti","Haiti","2019-11-12T12:00:59Z","2028-11-11T12:00:59Z","2019-12-27T12:00:59Z","Inter-American Development Bank Group","Fraudulent Practice"
"Rongcheng County Xinrong City Development Co., Ltd.","No. 2-7, Zhongjin Garden Community South of Aowei Road Rongcheng County Baoding City Hebei Province Peoples Republic of China","Peoples Republic of China","2024-07-22T12:00:59Z","2027-07-22T12:00:59Z","2024-09-16T12:00:59Z","Asian Development Bank","Fraudulent practice"
"Roprucsa Contratistas Generales S.A.","Av. Naranjal No. 543, Urbanizacion Naranjal, Distrito de Los Olivos 39, Lima","Peru",,Ongoing,"2024-03-11T10:13:59Z","World Bank Group","Fraudulent Practice"
"Roser Vicente Ruiz","Comte d Urqell, 204, 5B 08036 Barcelona Espana","Spain","2022-11-14T12:00:59Z","2032-11-13T12:00:59Z","2023-02-10T12:00:59Z","Inter-American Development Bank Group","Fraudulent practices and corrupt practice"
"Royal Dizayn Loyiha","Fergana Region Fergana District Sayilgoh Street 22B-House Uzbekistan","Uzbekistan",,Ongoing,"2024-05-31T10:52:59Z","World Bank Group","Coercive Practice"
