"Geometrica Construcoes Ltda (Geometrica)","Rua Do Passeio, 953, Sala 209, Centro, Sao Luis, Maranhao, Brazil","Brazil",,Ongoing,"2016-11-18T03:27:59Z","World Bank Group","Collusive Practice"
"George C. Benson","16520 South Tamiami Trail, suite 18 Fort Myers, FL33908 United State of America","USA","2016-09-20T02:51:59Z","2027-09-19T02:51:59Z","2017-05-31T02:51:59Z","Inter-American Development Bank Group","Fraudulent Practice"
"Gesaworld Chile Limitada","'Av. Padre Mariano 181 Of. 404 Providencia Santiago de Chile Chile Counsel: Lucinda Low/Brigida Benitez Steptoe & Johnson LLP 1330 Connecticut Avenue, NW Washington, DC 20036 United States of America '","Chile","2022-11-14T12:35:59Z","2031-11-13T12:35:59Z","2023-02-10T12:35:59Z","Inter-American Development Bank Group","Fraudulent Practice"
"Gesaworld México S.A. de C.V.","'Carretera Federal México-Toluca No. 1725 Sub Ancla Col. Granjas de Palo Alto 05118 México D.F. México Counsel: Lucinda Low/Brigida Benitez Steptoe & Johnson LLP 1330 Connecticut Avenue, NW Washington, DC 20036 United States of America '","Mexico","2022-11-14T12:37:59Z","2032-11-13T12:37:59Z","2023-02-10T12:37:59Z","Inter-American Development Bank Group","Fraudulent Practice"
"Gesaworld Panamá S.A.","'Calle 52 y Elvira Mendez Edif. Vallarino piso 5 Oficina A zona bancaria Panama city Panama Counsel: Lucinda Low/Brigida Benitez Steptoe & Johnson LLP 1330 Connecticut Avenue, NW Washington, DC 20036 United States of America '","Panama","2022-11-14T12:31:59Z","2031-11-13T12:31:59Z","2023-02-10T12:31:59Z","Inter-American Development Bank Group","Fraudulent Practice"
"Gesaworld S.A. also known as Gesaworld Group S.A.","Comte d Urqell, 204, 5B 08036 Barcelona Espana","Spain","2022-11-14T12:00:59Z","2032-11-13T12:00:59Z","2023-02-10T12:00:59Z","Inter-American Development Bank Group","Fraudulent Practice"
"Gesaworld USA Limited Liability Company","'333 SE 2nd Ave Suite 2016 22131 Miami, Fl United States Counsel: Lucinda Low/Brigida Benitez Steptoe & Johnson LLP 1330 Connecticut Avenue, NW Washington, DC 20036 United States of America '","United States of America","2022-11-14T12:33:59Z","2032-11-13T12:33:59Z","2023-02-10T12:33:59Z","Inter-American Development Bank Group","Fraudulent Practice"
"Gesaworld do Brasil Limitada","'Avenida Paulista, 1499 Cjs. 1106/07/08/09 01311-928 Sao Paulo Brazil Counsel: Raquel Lamboglia Guimaraes Manesco, Ramires, Perez, Azevedo Marques Sociedade de Advogados Ed. Santa Catarina. Av. Paulista, 287 7 andar. CEP 01311-000, Sao Paulo SP Brazil '","Brazil","2022-11-14T12:28:59Z","2032-11-13T12:28:59Z","2023-02-10T12:28:59Z","Inter-American Development Bank Group","Fraudulent Practice"
"Getinsa Ingeniería Vietnam Co. Ltd.","NV37, Trung Van New Urban Area Trung van Ward South Tu Liem Dist. Hanoi Vietnam","Vietnam","2021-11-29T02:32:59Z","2030-09-28T01:32:59Z","2023-06-09T01:32:59Z","World Bank Group","Collusive Practice"
"Gezhouba  Angola Co., Ltd.","RUA JO�O PAULO II LARGO DAS ESCOLA N� S/N, Luanda Angola","Angola","2024-07-01T12:00:59Z","2025-05-31T12:00:59Z","2024-07-01T12:00:59Z","EBRD","Fraudulent Practice"
"Gezhouba  Indonesia Construction Engineering Co., Ltd.","World Capital Tower Lt. 38 unit 01,16,17 & Koridor Jl. Dr. Ide Anak Agung Gde Agung Lot.D, Mega Kuningan Desa/Keluranhan Kuningan Timur Kec. Setiabudi Kota Adm. Jakarta Selatan Provinsi DKI Jakarta, Kode Pos: 12950","Indonesia","2024-07-01T12:00:59Z","2025-05-31T12:00:59Z","2024-07-01T12:00:59Z","EBRD","Fraudulent Practice"
"Gezhouba  Laohekou Cements Co., Ltd.","Hongshan Tsui Laohekou City Hubei Province People's Republic of China","People's Republic of China","2024-07-01T12:00:59Z","2025-05-31T12:00:59Z","2024-07-01T12:00:59Z","EBRD","Fraudulent Practice"
"Gezhouba (Beijing) Urban Construction Co., Ltd.","901, 903-914, 9th Floor 432 Yunjing East Road Tongzhou District Beijing People's Republic of China","People's Republic of China","2024-07-01T12:00:59Z","2025-05-31T12:00:59Z","2024-07-01T12:00:59Z","EBRD","Fraudulent Practice"
"Gezhouba (Guoluo) New Energy Co., Ltd.","West side of Binhe West Road Maduo County Guoluo Prefecture Qinghai Province People's Republic of China","People's Republic of China","2024-07-01T12:00:59Z","2025-05-31T12:00:59Z","2024-07-01T12:00:59Z","EBRD","Fraudulent Practice"
"Gezhouba (Haikou) Water Diversion Project Investment Co., Ltd.","21th floor, Guorui City (Baishi Yuan) DayingShandong East 1st Road Meilan District Haikou City Hainan Province People's Republic of China","People's Republic of China","2024-07-01T12:00:59Z","2025-05-31T12:00:59Z","2024-07-01T12:00:59Z","EBRD","Fraudulent Practice"
"Gezhouba (Haikou) Water Environment Treatment Investment Co., Ltd.","19th floor, Guorui City (Baishi Yuan) DayingShandong East 1st Road Meilan District Haikou City Hainan Province People's Republic of China","People's Republic of China","2024-07-01T12:00:59Z","2025-05-31T12:00:59Z","2024-07-01T12:00:59Z","EBRD","Fraudulent Practice"
"Gezhouba (Hainan Wenchang) Space City Project Development and Construction Co., Ltd.","No.177 Binwan Road Wencheng Town Wenchang Hainan People's Republic of China","People's Republic of China","2024-07-01T12:00:59Z","2025-05-31T12:00:59Z","2024-07-01T12:00:59Z","EBRD","Fraudulent Practice"
"Gezhouba (Hainan Yangpu) Construction and Development Co., Ltd.","Block B, 2nd Floor, Building D Blue Collar Apartment Phase II Xinying Bay Area Yangpu Economic Development Zone Hainan People's Republic of China","People's Republic of China","2024-07-01T12:00:59Z","2025-05-31T12:00:59Z","2024-07-01T12:00:59Z","EBRD","Fraudulent Practice"
"Gezhouba (Hainan) Construction Investment Co., Ltd.","Guorui City No.10 Dayingshan East 1st Road Meilan District Haikou Hainan People's Republic of China","People's Republic of China","2024-07-01T12:00:59Z","2025-05-31T12:00:59Z","2024-07-01T12:00:59Z","EBRD","Fraudulent Practice"
"Gezhouba (Harbin) Investment Construction Co., Ltd.","20F, Junkang Building intersection of Qunli Sixth Avenue and Langjiang Road Daoli District Harbin City People's Republic of China","People's Republic of China","2024-07-01T12:00:59Z","2025-05-31T12:00:59Z","2024-07-01T12:00:59Z","EBRD","Fraudulent Practice"
"Gezhouba (Huating) New Energy Co., Ltd.","Room 602, Annex Building of Humay Sunshine Hotel East of Lotus Lake Yizhou Avenue Huating City Pingliang City Gansu Province People's Republic of China","People's Republic of China","2024-07-01T12:00:59Z","2025-05-31T12:00:59Z","2024-07-01T12:00:59Z","EBRD","Fraudulent Practice"
"Gezhouba (Huizhou Huiyang) Investment and Construction Co., Ltd.","Inner Ring Road,Tuhu Baiyunkeng Huiyang Huizho Guangdong People's Republic of China","People's Republic of China","2024-07-01T12:00:59Z","2025-05-31T12:00:59Z","2024-07-01T12:00:59Z","EBRD","Fraudulent Practice"
"Gezhouba (Huludao) New Energy Co., Ltd.","5th Floor, Building 1#, Small and Micro Enterprise Incubation Park No.8 Taishan Road Beigang Economic Development Zone Huludao City Liaoning Province People's Republic of China","People's Republic of China","2024-07-01T12:00:59Z","2025-05-31T12:00:59Z","2024-07-01T12:00:59Z","EBRD","Fraudulent Practice"
"Gezhouba (Luoyang) Mining Co., Ltd. ","15-18, Building 1 Jinmao Building Chengguan Town Xin 'an County Luoyang Henan People's Republic of China","People's Republic of China","2024-07-01T12:00:59Z","2025-05-31T12:00:59Z","2024-07-01T12:00:59Z","EBRD","Fraudulent Practice"
"Gezhouba (Meishan) Energy Development Co., Ltd.","No. 255, Section 2, Pengzu Avenue Guanyin Street Pengshan District Meishan City Sichuan Province People's Republic of China","People's Republic of China","2024-07-01T12:00:59Z","2025-05-31T12:00:59Z","2024-07-01T12:00:59Z","EBRD","Fraudulent Practice"
"Gezhouba (Shaanxi) Energy Sales Co., Ltd.","Floor 6, Building 4-C, Central Business District Phase I Energy Finance and Trade Zone Fengdong New Town Xixian New District Shaanxi Province People's Republic of China","People's Republic of China","2024-07-01T12:00:59Z","2025-05-31T12:00:59Z","2024-07-01T12:00:59Z","EBRD","Fraudulent Practice"
"Gezhouba (Sichuan) Energy Sales Co., Ltd.","No. 1-3, Floor 22, Zhonghai Fortune Center No. 418 Xianghe 4th Street Tianfu New District Chengdu Sichuan Province People's Republic of China","People's Republic of China","2024-07-01T12:00:59Z","2025-05-31T12:00:59Z","2024-07-01T12:00:59Z","EBRD","Fraudulent Practice"
"Gezhouba (Wuhan) New Energy Development Co., Ltd.","No. 2, Floor 23, Building / Unit 11 Gezhouba Urban Garden Phase II No. 162 Qiaokou Road Qiaokou District Wuhan City People's Republic of China","People's Republic of China","2024-07-01T12:00:59Z","2025-05-31T12:00:59Z","2024-07-01T12:00:59Z","EBRD","Fraudulent Practice"
"Gezhouba (Yantai) Engineering Construction Co., Ltd.","No.15 Baiyanghe Road Economic Development Zone Fushan District Yantai City Shandong Province People's Republic of China","People's Republic of China","2024-07-01T12:00:59Z","2025-05-31T12:00:59Z","2024-07-01T12:00:59Z","EBRD","Fraudulent Practice"
"Gezhouba (Yichang) Commercial Concrete Co., Ltd.","No. 363, Juanqiaohe Road Dianjun District Yichang City (Electronic Information Industrial Park) People's Republic of China","People's Republic of China","2024-07-01T12:00:59Z","2025-05-31T12:00:59Z","2024-07-01T12:00:59Z","EBRD","Fraudulent Practice"
"Gezhouba (Yichang) High Speed Railway North Station New Energy Industrial Park Development Co., Ltd.","Group 7 Shuifu Temple Village Longquan Town Yiling Yichang People's Republic of China","People's Republic of China","2024-07-01T12:00:59Z","2025-05-31T12:00:59Z","2024-07-01T12:00:59Z","EBRD","Fraudulent Practice"
"Gezhouba (Yichang) Jinxiu Pharmacy Co., Ltd.","No. 70, Qiaohu Second Road Yichang City People's Republic of China","People's Republic of China","2024-07-01T12:00:59Z","2025-05-31T12:00:59Z","2024-07-01T12:00:59Z","EBRD","Fraudulent Practice"
"Gezhouba (Yichang) Livelihood Engineering Investment and Construction Co., Ltd.","35 Night Pearl Road Xiling District Yichang City Hubei Province People's Republic of China","People's Republic of China","2024-07-01T12:00:59Z","2025-05-31T12:00:59Z","2024-07-01T12:00:59Z","EBRD","Fraudulent Practice"
"Gezhouba Baiyin Pingchuan Pumped Storage Co., Ltd.","North of Changzheng West Road Dianli Road Street Pingchuan District Baiyin City Gansu Province (No. 1, 3F, Building 1, Dianli Road Street Office) People's Republic of China","People's Republic of China","2024-07-01T12:00:59Z","2025-05-31T12:00:59Z","2024-07-01T12:00:59Z","EBRD","Fraudulent Practice"
"Gezhouba Baiyin Pumped Storage Co., Ltd.","Building 7-01, Building 1 (12) No.67 Lanzhou Road Baiyin District Baiyin City Gansu Province People's Republic of China","People's Republic of China","2024-07-01T12:00:59Z","2025-05-31T12:00:59Z","2024-07-01T12:00:59Z","EBRD","Fraudulent Practice"
"Gezhouba Baoxiong (Baoding) Construction Development Co., Ltd.","Unit 1, Building 1, Zone A Economic Center of the headquarters of 'Ness � Smart Sea' Industrial Park Fengqi Street Lianchi District Baoding City Hebei Province People's Republic of China","People's Republic of China","2024-07-01T12:00:59Z","2025-05-31T12:00:59Z","2024-07-01T12:00:59Z","EBRD","Fraudulent Practice"
"Gezhouba Benxi Taizihe Pumped Storage Co., Ltd.","Door 6, Floor 1 to 2 Building 41, Huaxi Road Mingshan District Benxi City Liaoning Province","People's Republic of China","2024-07-01T12:00:59Z","2025-05-31T12:00:59Z","2024-07-01T12:00:59Z","EBRD","Fraudulent Practice"
"Gezhouba Chongqing Daxihe Hydro Power Development Co., Ltd.","Jianan Garden, Donghuan Road Nanchuan District Chongqing People's Republic of China","People's Republic of China","2024-07-01T12:00:59Z","2025-05-31T12:00:59Z","2024-07-01T12:00:59Z","EBRD","Fraudulent Practice"
"Gezhouba Chongzuo Building Materials Co., Ltd.","Room 101, Innovation and Entrepreneurship Service Center Zhongtai Industrial Park Industrial Avenue Chongzuo City People's Republic of China","People's Republic of China","2024-07-01T12:00:59Z","2025-05-31T12:00:59Z","2024-07-01T12:00:59Z","EBRD","Fraudulent Practice"
"Gezhouba City Development Co., Ltd.","No. 104, Block A No. 5, Gaopeng Avenue Chengdu High-tech Zone People's Republic of China","People's Republic of China","2024-07-01T12:00:59Z","2025-05-31T12:00:59Z","2024-07-01T12:00:59Z","EBRD","Fraudulent Practice"
"Gezhouba Communications Investment Sichuan Chongqing Investment (Tianjin) Partnership (Limited Partnership)","206-A022, No.127 Yanan Road Tianjin Pilot Free Trade Zone (Dongjiang Comprehensive Free Trade Zone) People's Republic of China","People's Republic of China","2024-07-01T12:00:59Z","2025-05-31T12:00:59Z","2024-07-01T12:00:59Z","EBRD","Fraudulent Practice"
"Gezhouba Construction Technology (Chengdu) Co., Ltd.","No.1777 North Side of Tianfu Avenue People's Republic of China","People's Republic of China","2024-07-01T12:00:59Z","2025-05-31T12:00:59Z","2024-07-01T12:00:59Z","EBRD","Fraudulent Practice"
"Gezhouba Ecological Construction (Hubei) Co., Ltd.","Room 1-1, 1-3F, Building 16, Gezhouba Sun City No. 40 Gaoxin 4 Road East Lake New Technology Development Zone Wuhan City Hubei Province People's Republic of China","People's Republic of China","2024-07-01T12:00:59Z","2025-05-31T12:00:59Z","2024-07-01T12:00:59Z","EBRD","Fraudulent Practice"
"Gezhouba Ecological and Environmental Protection (Jingmen) Co., Ltd.","Electronic Industrial Park No.9 Changxing Avenue Dongbao District Jingmen City People's Republic of China","People's Republic of China","2024-07-01T12:00:59Z","2025-05-31T12:00:59Z","2024-07-01T12:00:59Z","EBRD","Fraudulent Practice"
"Gezhouba Energy Sales Co., Ltd.","No.1701 Quality Inspection Building No. 1311 Longao North Road High-tech Zone Jinan City Shandong Province People's Republic of China","People's Republic of China","2024-07-01T12:00:59Z","2025-05-31T12:00:59Z","2024-07-01T12:00:59Z","EBRD","Fraudulent Practice"
"Gezhouba Group (Tibet) Construction Investment Co.,Ltd.","Room101,No.1, Block 57 Hailiang Centry New Town Liuwu New Area Lhasa Tibet","China","2024-07-01T12:00:59Z","2025-05-31T12:00:59Z","2024-07-01T12:00:59Z","Asian Development Bank","Fraudulent Practice"
"Gezhouba Group (Xiamen) Construction Investment Co., Ltd.","A1030, Unit 308, No. 16, Yunding North Road Huli District Xiamen People's Republic of China","People's Republic of China","2024-07-01T12:00:59Z","2025-05-31T12:00:59Z","2024-07-01T12:00:59Z","EBRD","Fraudulent Practice"
"Gezhouba Group Eco-environmental Protection Co., Ltd. ","No. 2, 37th Floor, Building 11 / Unit Gezhouba Urban Garden Phase II Qiaokou Road Qiaokou District Wuhan People's Republic of China","People's Republic of China","2024-07-01T12:00:59Z","2025-05-31T12:00:59Z","2024-07-01T12:00:59Z","EBRD","Fraudulent Practice"
"Gezhouba Group Logistics Co., Ltd.","2 Shiling Road Yichang City Hubei Province People's Republic of China","People's Republic of China","2024-07-01T12:00:59Z","2025-05-31T12:00:59Z","2024-07-01T12:00:59Z","EBRD","Fraudulent Practice"
"Gezhouba Group Machinery & Ship Co., Ltd. of China","No.18 Xiaoting Avenue Xiaoting District Yichang City Hubei Province People's Republic of China","People's Republic of China","2024-07-01T12:00:59Z","2025-05-31T12:00:59Z","2024-07-01T12:00:59Z","EBRD","Fraudulent Practice"
"Gezhouba Group Project Management Co., Ltd.","4-7 Floor, Building 11 Gezhouba City Garden Phase II No. 162 Qiaokou Road, Qiaokou District Wuhan City Hubei Province People's Republic of China","People's Republic of China","2024-07-01T12:00:59Z","2025-05-31T12:00:59Z","2024-07-01T12:00:59Z","EBRD","Fraudulent Practice"
"Gezhouba Group Shimen Special Cements Co., Ltd.","No.28 Shuangqiao Road Xinguan Community Xinguan Town Shimen County Changde City Hunan Province People's Republic of China","People's Republic of China","2024-07-01T12:00:59Z","2025-05-31T12:00:59Z","2024-07-01T12:00:59Z","EBRD","Fraudulent Practice"
"Gezhouba Group South China Construction Investment (Guangdong) Co., Ltd.","Room 358, Factory Building (Building B) Zhaoqing New Area Investment Development Co., LTD. Guicheng New Town North 8 District Dinghu District Zhaoqing City People's Republic of China","People's Republic of China","2024-07-01T12:00:59Z","2025-05-31T12:00:59Z","2024-07-01T12:00:59Z","EBRD","Fraudulent Practice"
"Gezhouba Group Supply Chain Management Co., Ltd.","Floor 12, Building 11 Gezhouba Urban Garden Phase II No.162 Qiaokou Road Qiaokou District Wuhan People's Republic of China","People's Republic of China","2024-07-01T12:00:59Z","2025-05-31T12:00:59Z","2024-07-01T12:00:59Z","EBRD","Fraudulent Practice"
"Gezhouba Group Testing and Inspection Co., Ltd.","13 Qingbo Road Xiling District Yichang City Hubei Province People's Republic of China","People's Republic of China","2024-07-01T12:00:59Z","2025-05-31T12:00:59Z","2024-07-01T12:00:59Z","EBRD","Fraudulent Practice"
"Gezhouba Group Transportation Investment Co., Ltd. ","No. 1, Floor 23, Building / Unit 11 Gezhouba Urban Garden Phase II No. 162 Qiaokou Road Qiaokou District Wuhan City People's Republic of China","People's Republic of China","2024-07-01T12:00:59Z","2025-05-31T12:00:59Z","2024-07-01T12:00:59Z","EBRD","Fraudulent Practice"
"Gezhouba Group Xiong'an Construction Investment Co., Ltd.","1-135 Conference Center South Section of Baojin Expressway Xiongan District China (Hebei) Free Trade Test Area People's Republic of China","People's Republic of China","2024-07-01T12:00:59Z","2025-05-31T12:00:59Z","2024-07-01T12:00:59Z","EBRD","Fraudulent Practice"
"Gezhouba Hanchuan Handian Cement Co., Ltd.","New River Industrial Park Hanchuan Economic Development Zone People's Republic of China","People's Republic of China","2024-07-01T12:00:59Z","2025-05-31T12:00:59Z","2024-07-01T12:00:59Z","EBRD","Fraudulent Practice"
"Gezhouba Hanzhong Hongyanping Pumped Storage Co., Ltd.","Pangjiaba(Commercial Center) Jingyang Village Jingyang Street Office Zhenba County Hanzhong City Shaanxi Province People's Republic of China","People's Republic of China","2024-07-01T12:00:59Z","2025-05-31T12:00:59Z","2024-07-01T12:00:59Z","EBRD","Fraudulent Practice"
"Gezhouba Honghu Commercial Concrete Co., Ltd.","Tonghu Avenue Xinlian Village Luoshan Town Honghu City Hubei Province People's Republic of China","People's Republic of China","2024-07-01T12:00:59Z","2025-05-31T12:00:59Z","2024-07-01T12:00:59Z","EBRD","Fraudulent Practice"
"Gezhouba Huaian Recycled Materials Co., Ltd.","No. 330 Yulan Avenue Economic Development Zone Xuyi County Huaian City People's Republic of China","People's Republic of China","2024-07-01T12:00:59Z","2025-05-31T12:00:59Z","2024-07-01T12:00:59Z","EBRD","Fraudulent Practice"
"Gezhouba Huanjia (Dalian) Renewable Resources Co., Ltd.","Zhongge Village Gezhenbao Town Ganjingzi District Dalian City Liaoning Province People's Republic of China","People's Republic of China","2024-07-01T12:00:59Z","2025-05-31T12:00:59Z","2024-07-01T12:00:59Z","EBRD","Fraudulent Practice"
"Gezhouba Hubei Nanhe Hydropower Development Co., Ltd.","No.212 Chengguan Town East Street Baokang Country People's Republic of China","People's Republic of China","2024-07-01T12:00:59Z","2025-05-31T12:00:59Z","2024-07-01T12:00:59Z","EBRD","Fraudulent Practice"
"Gezhouba Hubei Xiangjing Freeway Co., Ltd.","No.171 Peigong Avenue Jingmen District High-tech Zone Hubei Province People's Republic of China","People's Republic of China","2024-07-01T12:00:59Z","2025-05-31T12:00:59Z","2024-07-01T12:00:59Z","EBRD","Fraudulent Practice"
"Gezhouba Internatioal Hong Kong Co., Ltd.","26/F, BEAUTIFUL GROUP TOWER 77 CONNAUGHT ROAD CENTRAL CENTRAL HK Hong Kong People's Republi of China","People's Republic of China","2024-07-01T12:00:59Z","2025-05-31T12:00:59Z","2024-07-01T12:00:59Z","EBRD","Fraudulent Practice"
"Gezhouba Internatioal Russia Co., Ltd.","123112, Moscow Presnenskaya embankment 6 building 2, premises. 4306 Russian Federation","Russian Federation","2024-07-01T12:00:59Z","2025-05-31T12:00:59Z","2024-07-01T12:00:59Z","EBRD","Fraudulent Practice"
"Gezhouba Investment Hong Kong Company Limited","2-1204 Kuangshi International Building Tianjin Pilot Free Trade Zone (Central Business District) (Tianjin Xinlong Commercial Secretary Co., LTD. No. 0382) People's Republic of China","People's Republic of China","2024-07-01T12:00:59Z","2025-05-31T12:00:59Z","2024-07-01T12:00:59Z","EBRD","Fraudulent Practice"
"Gezhouba Jiexin (Wuhan) Technology Co., Ltd.","Room 1, Floor 1-3, Building 15 Gezhouba Sun City East Lake High-tech Developmen Zone Wuhan City People's Republic of China","People's Republic of China","2024-07-01T12:00:59Z","2025-05-31T12:00:59Z","2024-07-01T12:00:59Z","EBRD","Fraudulent Practice"
"Gezhouba Jingmen Cement Co., Ltd.","Jianquan Village Zilingpu Town Dongbao District Jingmen City People's Republic of China","People's Republic of China","2024-07-01T12:00:59Z","2025-05-31T12:00:59Z","2024-07-01T12:00:59Z","EBRD","Fraudulent Practice"
"Gezhouba Jingzhou Building Materials Co., Ltd.","East Avenue Extension Jingzhou Development Zone People's Republic of China","People's Republic of China","2024-07-01T12:00:59Z","2025-05-31T12:00:59Z","2024-07-01T12:00:59Z","EBRD","Fraudulent Practice"
"Gezhouba Jizhong Construction Baoding Co., Ltd.","No. 31 Yukang Street Xianfeng Street Office Jingxiu District Baoding City Hebei Province People's Republic of China","People's Republic of China","2024-07-01T12:00:59Z","2025-05-31T12:00:59Z","2024-07-01T12:00:59Z","EBRD","Fraudulent Practice"
"Gezhouba Laohekou Commercial Concrete Co., Ltd.","Fengying Village South Side of Mengtu Road Laohekou City People's Republic of China","People's Republic of China","2024-07-01T12:00:59Z","2025-05-31T12:00:59Z","2024-07-01T12:00:59Z","EBRD","Fraudulent Practice"
"Gezhouba Lingang Yicheng Building Materials Co., Ltd.","Lingang Economic Zone Xiaohe Town Yicheng City Xiangyang City Hubei Province People's Republic of China","People's Republic of China","2024-07-01T12:00:59Z","2025-05-31T12:00:59Z","2024-07-01T12:00:59Z","EBRD","Fraudulent Practice"
"Gezhouba Liulang Badong County Pumped Storage Co., Ltd. ","Chengcheng Building 30 Chaoyang Road Xinling Town Badong County People's Republic of China","People's Republic of China","2024-07-01T12:00:59Z","2025-05-31T12:00:59Z","2024-07-01T12:00:59Z","EBRD","Fraudulent Practice"
"Gezhouba Malaysia Co., Ltd.","Unit 19-11-1, Level 11 Office Suite, Wisma UOA Centre No.19, Jalan Pinang 50450, kuala Lumpur Malaysia","Malaysia","2024-07-01T12:00:59Z","2025-05-31T12:00:59Z","2024-07-01T12:00:59Z","EBRD","Fraudulent Practice"
"Gezhouba Manasi River Power Development Co., Ltd.","63 Tuanjie Road Manas County Changji Prefecture Xinjiang People's Republic of China","People's Republic of China","2024-07-01T12:00:59Z","2025-05-31T12:00:59Z","2024-07-01T12:00:59Z","EBRD","Fraudulent Practice"
"Gezhouba Mandalay Cement Co., Ltd.","Mandalay City Mandalay Province Myanmar","Myanmar","2024-07-01T12:00:59Z","2025-05-31T12:00:59Z","2024-07-01T12:00:59Z","EBRD","Fraudulent Practice"
"Gezhouba Mine Construction Engineering Co., Ltd.","No. 1, Floor 1-4, Unit 1-10 Building No. 8 Tongcheng Road Qingyang District Chengdu People's Republic of China","People's Republic of China","2024-07-01T12:00:59Z","2025-05-31T12:00:59Z","2024-07-01T12:00:59Z","EBRD","Fraudulent Practice"
"Gezhouba Mongolia Co., Ltd.","302, 3 rd Floor Shine Dul complex Narnii zam 99/A, 6 th khoroo Bayanzurkh District Ulaanbaatar Mongolia","Mongolia","2024-07-01T12:00:59Z","2025-05-31T12:00:59Z","2024-07-01T12:00:59Z","EBRD","Fraudulent Practice"
"Gezhouba Municipal Engineering (Haikou) Co., Ltd.","A1Luneng Hainan coconut wind Phase II (plot 2) commercial Street Qiongshan Avenue 8 Meilan District Haikou City Hainan Province People's Republic of China","People's Republic of China","2024-07-01T12:00:59Z","2025-05-31T12:00:59Z","2024-07-01T12:00:59Z","EBRD","Fraudulent Practice"
"Gezhouba Municipal Engineering (Jiangmen) Co., Ltd.","Room 604, Building 2 Jiangmen Wanda Plaza Pengjiang District Jiangmen City People's Republic of China","People's Republic of China","2024-07-01T12:00:59Z","2025-05-31T12:00:59Z","2024-07-01T12:00:59Z","EBRD","Fraudulent Practice"
"Gezhouba New Energy (Tianjin) Co., Ltd.","2-1102 No.10 Ziyuehua Di, North of Huangshan Avenue East of East Ninghai Road Tanggu Ocean Science and Technology Park Binhai High-tec Area Tianjin People's Republic of China","People's Republic of China","2024-07-01T12:00:59Z","2025-05-31T12:00:59Z","2024-07-01T12:00:59Z","EBRD","Fraudulent Practice"
"Gezhouba Oil and Gas Engineering Co., Ltd.","Wennan Road Development Zone Qionglai City Chengdu People's Republic of China","People's Republic of China","2024-07-01T12:00:59Z","2025-05-31T12:00:59Z","2024-07-01T12:00:59Z","EBRD","Fraudulent Practice"
"Gezhouba Panama Co., Ltd.","Panama Province Panama District Bellavista District Marbella Urbanization Anastasio Ruiz Street Torre de Pacifico Building, 20A Apartments","Panama","2024-07-01T12:00:59Z","2025-05-31T12:00:59Z","2024-07-01T12:00:59Z","EBRD","Fraudulent Practice"
"Gezhouba Papua New Guinea Co., Ltd.","Section 515, Allotments 8 &9 Waigani Drive HOHOLA National Capital District Papua New Guines","Papua New Guinea","2024-07-01T12:00:59Z","2025-05-31T12:00:59Z","2024-07-01T12:00:59Z","EBRD","Fraudulent Practice"
"Gezhouba Power Investment Co., Ltd.","No.3-12, Building 10 No.8 Guangfu Road Qingyang District Chengdu People's Republic of China","People's Republic of China","2024-07-01T12:00:59Z","2025-05-31T12:00:59Z","2024-07-01T12:00:59Z","EBRD","Fraudulent Practice"
"Gezhouba Qianjiang Cement Co., Ltd.","No.131 Jingshi Road Zhangjin Town Qianjiang City People's Republic of China","People's Republic of China","2024-07-01T12:00:59Z","2025-05-31T12:00:59Z","2024-07-01T12:00:59Z","EBRD","Fraudulent Practice"
